{
  "$schema": "https://json-schema.org/draft/2020-12/schema",
  "title": "Hypothesis",
  "description": "A falsifiable claim about the codex or its corpus, bound to a test kind implemented in src/falsify.py.",
  "type": "object",
  "required": [
    "id",
    "statement",
    "rationale",
    "prediction",
    "test",
    "status"
  ],
  "properties": {
    "id": {
      "type": "string",
      "pattern": "^(H[0-9]{3}|H-[A-Z]+(-[0-9]+)?)$",
      "description": "H001..H008 are the original numbered series. H-ARCH-n and H-BYPASS belong to the architecture layer, which was added beside the numbered series rather than renumbering it."
    },
    "statement": {
      "type": "string",
      "description": "The claim, written so that a result can contradict it."
    },
    "rationale": {
      "type": "string",
      "description": "Why this is worth testing \u2014 what breaks if the claim is false."
    },
    "prediction": {
      "type": "string",
      "description": "What the run must show for the claim to survive. Stated before the run."
    },
    "test": {
      "type": "object",
      "required": [
        "kind"
      ],
      "properties": {
        "kind": {
          "type": "string",
          "description": "Key into the TESTS registry in src/falsify.py.",
          "enum": [
            "id_consistency",
            "unlock_resolution",
            "era_longevity_coherence",
            "evidence_floor",
            "domain_coverage",
            "rubric_discrimination",
            "phi_significance",
            "taxonomy_exercised",
            "layer_role_coverage",
            "system_runs_on",
            "integration_saturation",
            "evaluator_bypass"
          ]
        },
        "params": {
          "type": "object",
          "description": "Thresholds and settings. Changing these is a revision and belongs in the revisions array."
        }
      }
    },
    "measures": {
      "type": "object",
      "description": "CLAUDE.md RULE 1. A hypothesis is an attempt to measure a TARGET through a RENDERING. Falsifying the rendering does not close the target. When a hypothesis carrying this block is falsified, src/falsify.py raises target_question as an open unknown, unless target_reached is true.",
      "required": [
        "target",
        "rendering"
      ],
      "properties": {
        "target": {
          "type": "string",
          "description": "What this is trying to measure."
        },
        "rendering": {
          "type": "string",
          "description": "The specific method or claim that carries the attempt, and the thing a falsification lands on."
        },
        "target_question": {
          "type": "string",
          "description": "The target written as a question, for the unknowns register."
        },
        "target_reached": {
          "type": "boolean",
          "description": "True only when the test reaches the target itself and not merely its rendering. Default false. Setting it true suppresses the auto-raise, so it is a claim and belongs in revisions if it changes."
        }
      }
    },
    "status": {
      "type": "string",
      "enum": [
        "open",
        "supported",
        "falsified",
        "no_data",
        "retired"
      ],
      "description": "Written by the engine on each run. 'open' means never run. 'no_data' means the test ran and could not reach a verdict \u2014 distinct from both other outcomes, and never counted as a pass."
    },
    "revisions": {
      "type": "array",
      "description": "Edits made to the claim after a falsification. Append only; the ledger holds the runs that forced them.",
      "items": {
        "type": "object",
        "required": [
          "run",
          "because"
        ],
        "properties": {
          "run": {
            "type": "string"
          },
          "was": {
            "type": "string"
          },
          "became": {
            "type": "string"
          },
          "because": {
            "type": "string"
          }
        }
      }
    },
    "last_result": {
      "type": "object",
      "description": "Written by the engine. The ledger is the durable record; this is a convenience.",
      "properties": {
        "run": {
          "type": "string"
        },
        "passed": {
          "type": [
            "boolean",
            "null"
          ],
          "description": "true supported, false falsified, null no data."
        },
        "summary": {
          "type": "string"
        }
      }
    }
  }
}
