{
  "id": "H006",
  "statement": "The keystone rule set retains resolution: it does not pile the corpus against its own ceiling, and its criteria bite.",
  "rationale": "A test that everything passes is not a test. If every encoded entry clears the bar, the proof engine is confirming the selection that put those entries in the repository, not evaluating them.",
  "prediction": "No more than 50% of entries score the maximum possible, the spread between highest and lowest is at least 0.2, and at least one criterion fails for at least one entry.",
  "test": {
    "kind": "rubric_discrimination",
    "params": {
      "max_ceiling_fraction": 0.5,
      "min_score_spread": 0.2
    }
  },
  "status": "supported",
  "revisions": [
    {
      "run": "run-004-merge-main",
      "was": "No more than 90% of encoded entries score as keystones, and the spread is at least 0.2.",
      "became": "No more than 50% of entries sit at the ceiling, spread at least 0.2, and at least one criterion bites.",
      "because": "Falsified at 37/40 passing after the merge, but the diagnosis was wrong: a corpus curated to hold keystones should mostly pass, so pass-fraction measures curation rather than the rubric. Measured on one corpus, v1.0 puts 80% at the ceiling against v1.1's 32% \u2014 while v1.0's spread is the LARGER of the two, 0.60 against 0.38. Spread alone would rank the retired rubric above its replacement. Ceiling saturation is the statistic that actually separates them, so the claim was rewritten around it rather than the threshold nudged until the corpus fit."
    }
  ],
  "last_result": {
    "run": "run-007-anatolia-findings",
    "passed": true,
    "summary": "40/44 pass, 30% at ceiling, spread 0.460 \u2014 rubric discriminates"
  }
}
